{
  "ioc_id": "ioc_17e092888358b0e21dcb2385",
  "type": "payload_sha256",
  "value": "061f6e75bb4f65a2b379124cefacf9feca6570cf5b52e88419d4ab06189f13b2",
  "display": "061f6e75bb4f65a2b379124cefacf9feca6570cf5b52e88419d4ab06189f13b2",
  "roles": [
    "payload"
  ],
  "origin": "observed",
  "redacted": false,
  "file_ioc_limited": false,
  "first_seen": 1792285400003,
  "last_seen": 1792285400003,
  "sightings": 1,
  "attempt_ids": [
    "att_9c09513968e521d297116de5"
  ],
  "campaign_ids": [],
  "decoy_ids": [
    "dcy-demo-1"
  ],
  "catalogue_ids": [
    "foiled/demo-app/1.0.0"
  ],
  "event_ids": [
    "fd-02"
  ],
  "extracted_from": [
    "hook:data.request_slice_sha256"
  ],
  "enrichment": [],
  "confidence": {
    "score": 68,
    "band": "medium",
    "wording": "we assess as",
    "publishable": true,
    "evidence": [
      {
        "signal_id": "decoy:dcy-demo-1",
        "source": "catalogue_prior",
        "weight": 100,
        "summary": "seen at decoy dcy-demo-1, which has no legitimate users"
      },
      {
        "signal_id": "hook:att_9c09513968e521d297116de5:demo-app.upload-path-traversal",
        "source": "vuln_path_hook",
        "weight": 100,
        "summary": "seen in attempt att_9c09513968e521d297116de5, where vulnerable-path hook demo-app.upload-path-traversal fired",
        "ref": "fd-02"
      },
      {
        "signal_id": "noise:ioc_17e092888358b0e21dcb2385",
        "source": "noise_score",
        "weight": 10,
        "summary": "lowest source noise score across sightings is 10"
      }
    ],
    "caps_applied": []
  }
}
