{
  "ioc_id": "ioc_4f12a8da5e7f663e8760769e",
  "type": "http_path",
  "value": "/.env",
  "display": "/.env",
  "roles": [
    "request"
  ],
  "origin": "observed",
  "redacted": false,
  "file_ioc_limited": false,
  "first_seen": 1792285600000,
  "last_seen": 1792285600000,
  "sightings": 1,
  "attempt_ids": [
    "att_aadc7d17108cec3c48b25818"
  ],
  "campaign_ids": [],
  "decoy_ids": [
    "dcy-demo-1"
  ],
  "catalogue_ids": [
    "foiled/demo-app/1.0.0"
  ],
  "event_ids": [
    "fd-07"
  ],
  "extracted_from": [
    "application:data.path"
  ],
  "enrichment": [],
  "confidence": {
    "score": 8,
    "band": "low",
    "wording": "we assess as",
    "publishable": false,
    "evidence": [
      {
        "signal_id": "decoy:dcy-demo-1",
        "source": "catalogue_prior",
        "weight": 100,
        "summary": "seen at decoy dcy-demo-1, which has no legitimate users"
      },
      {
        "signal_id": "noise:ioc_4f12a8da5e7f663e8760769e",
        "source": "noise_score",
        "weight": 10,
        "summary": "lowest source noise score across sightings is 10"
      }
    ],
    "caps_applied": []
  }
}
