{
  "ioc_id": "ioc_94f11fa9e330cd14f4024544",
  "type": "request_substring",
  "value": "CONFIG SET dir /var/spool/cron",
  "display": "CONFIG SET dir /var/spool/cron",
  "roles": [
    "request"
  ],
  "origin": "observed",
  "redacted": false,
  "file_ioc_limited": false,
  "first_seen": 1792285500000,
  "last_seen": 1792285500000,
  "sightings": 1,
  "attempt_ids": [
    "att_1f168ea9598d08f00bc25e5e"
  ],
  "campaign_ids": [],
  "decoy_ids": [
    "dcy-redis-1"
  ],
  "catalogue_ids": [
    "emulator/redis/7.0"
  ],
  "event_ids": [
    "fd-06"
  ],
  "extracted_from": [
    "application:data.command"
  ],
  "enrichment": [],
  "confidence": {
    "score": 8,
    "band": "low",
    "wording": "we assess as",
    "publishable": false,
    "evidence": [
      {
        "signal_id": "decoy:dcy-redis-1",
        "source": "catalogue_prior",
        "weight": 100,
        "summary": "seen at decoy dcy-redis-1, which has no legitimate users"
      },
      {
        "signal_id": "noise:ioc_94f11fa9e330cd14f4024544",
        "source": "noise_score",
        "weight": 10,
        "summary": "lowest source noise score across sightings is 10"
      }
    ],
    "caps_applied": []
  }
}
